{
  "schema_version": "0.3.0",
  "artifact_type": "crawl_result",
  "artifact_id": "crawl_result-run_demo_001-000-1a2b3c4d",
  "run_id": "run_demo_001",
  "iteration": 0,
  "producer": "collector",
  "mode": "development",
  "created_at": "2026-10-07T00:02:00Z",
  "status": "completed",
  "input_refs": [],
  "errors": [],
  "runtime_metrics": {"duration_ms": 1200, "llm_calls": 0, "input_tokens": 0, "output_tokens": 0, "peak_memory_mb": null},
  "data": {
    "target_url": "http://target.example.test/",
    "roles": [{"role_id": "role_user", "name": "user"}],
    "accounts": [
      {"account_id": "acc_alice", "role_id": "role_user", "alias": "alice", "session_ref": "sess_alice"},
      {"account_id": "acc_bob", "role_id": "role_user", "alias": "bob", "session_ref": "sess_bob"}
    ],
    "pages": [],
    "actions": [],
    "requests": [
      {
        "request_id": "req_alice_order", "account_id": "acc_alice", "role_id": "role_user", "session_ref": "sess_alice",
        "page_id": null, "action_id": null, "method": "GET", "url": "http://target.example.test/orders/1",
        "observed_at": "2026-10-07T00:00:01Z", "parameters": [], "headers": [], "body_ref": null,
        "response": {"status_code": 200, "content_type": "application/json", "headers": [], "body_ref": null, "identifiers": null, "identifiers_truncated": false},
        "evidence_refs": []
      },
      {
        "request_id": "req_alice_orders", "account_id": "acc_alice", "role_id": "role_user", "session_ref": "sess_alice",
        "page_id": null, "action_id": null, "method": "GET", "url": "http://target.example.test/orders",
        "observed_at": "2026-10-07T00:00:02Z", "parameters": [], "headers": [], "body_ref": null,
        "response": {"status_code": 200, "content_type": "application/json", "headers": [], "body_ref": null, "identifiers": null, "identifiers_truncated": false},
        "evidence_refs": []
      },
      {
        "request_id": "req_alice_order_a", "account_id": "acc_alice", "role_id": "role_user", "session_ref": "sess_alice",
        "page_id": null, "action_id": null, "method": "GET", "url": "http://target.example.test/orders/a",
        "observed_at": "2026-10-07T00:00:03Z", "parameters": [], "headers": [], "body_ref": null,
        "response": {"status_code": 200, "content_type": "application/json", "headers": [], "body_ref": null, "identifiers": null, "identifiers_truncated": false},
        "evidence_refs": []
      },
      {
        "request_id": "req_bob_order_b", "account_id": "acc_bob", "role_id": "role_user", "session_ref": "sess_bob",
        "page_id": null, "action_id": null, "method": "GET", "url": "http://target.example.test/orders/b",
        "observed_at": "2026-10-07T00:00:04Z", "parameters": [], "headers": [], "body_ref": null,
        "response": {"status_code": 200, "content_type": "application/json", "headers": [], "body_ref": null, "identifiers": null, "identifiers_truncated": false},
        "evidence_refs": []
      }
    ],
    "discovered_endpoints": []
  }
}
